{
  "stage1_ingestion": {
    "case_id": "CS-002",
    "source": "US Department of Justice",
    "reference": "https://www.justice.gov/usao-cdca/pr/us-navy-sailor-sentenced-more-2-years-prison-transmitting-sensitive-us-military",
    "case_summary": "A U.S. military insider with a security clearance was convicted after accepting bribes from a foreign intelligence officer in exchange for sensitive, non-public operational and technical military information. Over an extended period, the individual exploited authorised access to restricted areas and transmitted classified-related details using encrypted communications.",
    "include_for_stage_2": true,
    "screening_note": ""
  },
  "catalyst": {
    "precipitating_event": "unknown"
  },
  "actor_characteristics": {
    "type_of_actor": [
      "unknown"
    ],
    "enterprise_role": [
      "unknown"
    ],
    "state_of_relationship": [
      "unknown"
    ],
    "psychological_state": [
      "unknown"
    ],
    "personality_characteristics": [
      "unknown"
    ],
    "attitude_towards_work": [
      "unknown"
    ],
    "motivation_to_attack": [
      "unknown"
    ],
    "skill_set": "unknown",
    "opportunity": [
      "unknown"
    ],
    "historical_behaviour": [
      "unknown"
    ],
    "observed_physical_behaviour": [
      "unknown"
    ],
    "observed_cyber_behaviour": [
      "unknown"
    ]
  },
  "attack_characteristics": {
    "attack": "unknown",
    "attack_objective": "unknown",
    "attack_step": [
      "unknown"
    ],
    "attack_step_goal": [
      "unknown"
    ]
  },
  "organisation_characteristics": {
    "asset": "unknown",
    "vulnerability": [
      "unknown"
    ]
  }
}
