{
  "stage1_ingestion": {
    "case_id": "CS-004",
    "source": "US Department of Justice",
    "reference": "https://www.justice.gov/usao-sdny/pr/former-employee-technology-company-pleads-guilty-stealing-confidential-data-and",
    "case_summary": "A senior employee at a technology company misused privileged administrative access to secretly exfiltrate large amounts of confidential company data. The individual later attempted to extort the employer by demanding cryptocurrency in exchange for returning the stolen information and falsely posing as an external attacker while also publishing misleading information that harmed the company’s reputation and market value.",
    "include_for_stage_2": false,
    "screening_note": ""
  },
  "catalyst": {
    "precipitating_event": "unknown"
  },
  "actor_characteristics": {
    "type_of_actor": [
      "unknown"
    ],
    "enterprise_role": [
      "unknown"
    ],
    "state_of_relationship": [
      "unknown"
    ],
    "psychological_state": [
      "unknown"
    ],
    "personality_characteristics": [
      "unknown"
    ],
    "attitude_towards_work": [
      "unknown"
    ],
    "motivation_to_attack": [
      "unknown"
    ],
    "skill_set": "unknown",
    "opportunity": [
      "unknown"
    ],
    "historical_behaviour": [
      "unknown"
    ],
    "observed_physical_behaviour": [
      "unknown"
    ],
    "observed_cyber_behaviour": [
      "unknown"
    ]
  },
  "attack_characteristics": {
    "attack": "unknown",
    "attack_objective": "unknown",
    "attack_step": [
      "unknown"
    ],
    "attack_step_goal": [
      "unknown"
    ]
  },
  "organisation_characteristics": {
    "asset": "unknown",
    "vulnerability": [
      "unknown"
    ]
  }
}
