{
  "stage1_ingestion": {
    "case_id": "CS-001",
    "source": "US Department of Justice",
    "reference": "https://www.justice.gov/archives/opa/pr/former-federal-employees-sentenced-conspiracy-steal-proprietary-us-government-software-and",
    "case_summary": "Three former employees of the Department of Homeland Security and the United States Postal Service Office of Inspector General conspired to steal proprietary government software and sensitive law-enforcement databases containing PII of over 200,000 federal employees. Using their privileged IT access and trusted positions, they exfiltrated data and shared it with external developers in India to build a commercial product",
    "include_for_stage_2": true,
    "screening_note": ""
  },
  "catalyst": {
    "precipitating_event": "unknown"
  },
  "actor_characteristics": {
    "type_of_actor": [
      "unknown"
    ],
    "enterprise_role": [
      "unknown"
    ],
    "state_of_relationship": [
      "unknown"
    ],
    "psychological_state": [
      "unknown"
    ],
    "personality_characteristics": [
      "unknown"
    ],
    "attitude_towards_work": [
      "unknown"
    ],
    "motivation_to_attack": [
      "unknown"
    ],
    "skill_set": "unknown",
    "opportunity": [
      "unknown"
    ],
    "historical_behaviour": [
      "unknown"
    ],
    "observed_physical_behaviour": [
      "unknown"
    ],
    "observed_cyber_behaviour": [
      "unknown"
    ]
  },
  "attack_characteristics": {
    "attack": "unknown",
    "attack_objective": "unknown",
    "attack_step": [
      "unknown"
    ],
    "attack_step_goal": [
      "unknown"
    ]
  },
  "organisation_characteristics": {
    "asset": "unknown",
    "vulnerability": [
      "unknown"
    ]
  }
}
